{
  "certificate_schema_version": "0.1",
  "spec_version": "v0.1-draft",
  "tool_version": "0.0.1",
  "skill": {
    "id": "object-flip",
    "sha256": "4b71919b63e2c024089d5f3f9b9ed9d1e5036e1df964635db8955eaa5ad60359"
  },
  "embodiment": {
    "id": "wonik-allegro-v4",
    "sha256": "281fb36f833d432604c998cb7878859d0d183471903551f9e5d38875fdac4ebe"
  },
  "report_sha256": "66a19b2483284ac43f9657a71e158954181a282a018caf8e936f9ea00cacb5a1",
  "result": "pass",
  "covered": [
    "class3_driver_protocol"
  ],
  "excluded": [
    "class4_physical",
    "class2_loose_epsilon",
    "env3_disturbance",
    "fidelity_tier_physical_truth"
  ],
  "actions": [
    {
      "action_id": "object-flip/wonik-allegro-v4/0001-locate",
      "suffix": "locate",
      "checks": [
        {
          "name": "actuation",
          "result": "pass"
        },
        {
          "name": "engagement",
          "result": "pass"
        },
        {
          "name": "irreversible",
          "result": "pass"
        },
        {
          "name": "freed_part_disposition",
          "result": "pass"
        },
        {
          "name": "audit_honesty",
          "result": "pass"
        },
        {
          "name": "audit_record",
          "result": "pass"
        },
        {
          "name": "support_safe_state",
          "result": "pass"
        },
        {
          "name": "hold_test",
          "result": "pass"
        },
        {
          "name": "flip_bounded_window",
          "result": "pass"
        },
        {
          "name": "make_before_break",
          "result": "pass"
        },
        {
          "name": "controlled_under_actuation",
          "result": "pass"
        },
        {
          "name": "two_party_handoff",
          "result": "pass"
        }
      ],
      "passed": true
    },
    {
      "action_id": "object-flip/wonik-allegro-v4/0002-pinch",
      "suffix": "pinch",
      "envelope_class": "grasp_continuity",
      "fidelity_tier": "manifold",
      "checks": [
        {
          "name": "envelope",
          "result": "pass"
        },
        {
          "name": "actuation",
          "result": "pass"
        },
        {
          "name": "engagement",
          "result": "pass"
        },
        {
          "name": "irreversible",
          "result": "pass"
        },
        {
          "name": "freed_part_disposition",
          "result": "pass"
        },
        {
          "name": "audit_honesty",
          "result": "pass"
        },
        {
          "name": "audit_record",
          "result": "pass"
        },
        {
          "name": "support_safe_state",
          "result": "pass"
        },
        {
          "name": "hold_test",
          "result": "pass"
        },
        {
          "name": "flip_bounded_window",
          "result": "pass"
        },
        {
          "name": "make_before_break",
          "result": "pass"
        },
        {
          "name": "controlled_under_actuation",
          "result": "pass"
        },
        {
          "name": "two_party_handoff",
          "result": "pass"
        }
      ],
      "passed": true
    },
    {
      "action_id": "object-flip/wonik-allegro-v4/0003-flip",
      "suffix": "flip",
      "envelope_class": "grasp_continuity",
      "checks": [
        {
          "name": "envelope",
          "result": "pass"
        },
        {
          "name": "actuation",
          "result": "pass"
        },
        {
          "name": "engagement",
          "result": "pass"
        },
        {
          "name": "irreversible",
          "result": "pass"
        },
        {
          "name": "freed_part_disposition",
          "result": "pass"
        },
        {
          "name": "audit_honesty",
          "result": "pass"
        },
        {
          "name": "audit_record",
          "result": "pass"
        },
        {
          "name": "support_safe_state",
          "result": "pass"
        },
        {
          "name": "hold_test",
          "result": "pass"
        },
        {
          "name": "flip_bounded_window",
          "result": "pass"
        },
        {
          "name": "make_before_break",
          "result": "pass"
        },
        {
          "name": "controlled_under_actuation",
          "result": "pass"
        },
        {
          "name": "two_party_handoff",
          "result": "pass"
        }
      ],
      "passed": true
    },
    {
      "action_id": "object-flip/wonik-allegro-v4/0004-release",
      "suffix": "release",
      "envelope_class": "grasp_continuity",
      "checks": [
        {
          "name": "envelope",
          "result": "pass"
        },
        {
          "name": "actuation",
          "result": "pass"
        },
        {
          "name": "engagement",
          "result": "pass"
        },
        {
          "name": "irreversible",
          "result": "pass"
        },
        {
          "name": "freed_part_disposition",
          "result": "pass"
        },
        {
          "name": "audit_honesty",
          "result": "pass"
        },
        {
          "name": "audit_record",
          "result": "pass"
        },
        {
          "name": "support_safe_state",
          "result": "pass"
        },
        {
          "name": "hold_test",
          "result": "pass"
        },
        {
          "name": "flip_bounded_window",
          "result": "pass"
        },
        {
          "name": "make_before_break",
          "result": "pass"
        },
        {
          "name": "controlled_under_actuation",
          "result": "pass"
        },
        {
          "name": "two_party_handoff",
          "result": "pass"
        }
      ],
      "passed": true
    }
  ],
  "sequence_checks": [
    {
      "name": "momentary_release",
      "result": "pass"
    }
  ],
  "content_hash": "sha256:64bd8d937b31285f9994962941509cbb491e878acb96b4b54280d73daa844880"
}